acapite,appURL,descripcionEtapa,descripcionSubEtapa,estadoProyecto,expedienteCamara,fechaIngresoExpediente,idProyecto,iniciativa,origenProyecto,tipoProyecto,urgencia
"Proyecto de Declaración “QUE INSTA A ITAIPÚ BINACIONAL A FINANCIAR LA ELABORACIÓN DE UN PLAN O PROYECTO METROPOLITANO DE TRANSPORTE PÚBLICO PARA ASUNCIÓN Y ÁREA METROPOLITANA”, presentado por el Senador Derlis Ariel Alejandro Osorio Nunes, de fecha 10 de mayo de 2023.",http://silpy.congreso.gov.py/expediente/128123,PRIMER TRÁMITE CONSTITUCIONAL,DICTAMEN DE COMISIÓN,EN TRAMITE,S-2311468,11/05/2023,128123,PARLAMENTARIA,CAMARA DE SENADORES,DECLARACIONES UNICAMERALES - (Art. 108-CS y 104-CD REGLAMENTO INTERNO ),ORDINARIO
"Proyecto de Resolución “QUE PIDE INFORME AL PODER EJECUTIVO – MINISTERIO DE OBRAS PÚBLICAS Y COMUNICACIONES”, presentado por el Senador Enrique Salyn Concepción Buzarquis Cáceres, de fecha 11 de mayo de 2023.",http://silpy.congreso.gov.py/expediente/128122,PRIMER TRÁMITE CONSTITUCIONAL,DICTAMEN DE COMISIÓN,EN TRAMITE,S-2311473,11/05/2023,128122,PARLAMENTARIA,CAMARA DE SENADORES,RESOLUCION CON RESPUESTA A PEDIDO DE INFORMES (Art. 192 CN),ORDINARIO
"Proyecto de Resolución “QUE PIDE INFORME AL PODER EJECUTIVO – MINISTERIO DE OBRAS PÚBLICAS Y COMUNICACIONES”, presentado por el Senador Enrique Salyn Concepción Buzarquis Cáceres, de fecha 11 de mayo de 2023.",http://silpy.congreso.gov.py/expediente/128121,PRIMER TRÁMITE CONSTITUCIONAL,DICTAMEN DE COMISIÓN,EN TRAMITE,S-2311472,11/05/2023,128121,PARLAMENTARIA,CAMARA DE SENADORES,RESOLUCION CON RESPUESTA A PEDIDO DE INFORMES (Art. 192 CN),ORDINARIO
"Proyecto de Declaración “QUE DECLARA DE INTERÉS NACIONAL EL VIII CONGRESO SUDAMERICANO DE YERBA MATE – PARAGUAY 2023”, presentado por el Senador Juan Eudes Afara Maciel, de fecha 4 de mayo de 2023.",http://silpy.congreso.gov.py/expediente/128120,PRIMER TRÁMITE CONSTITUCIONAL,DICTAMEN DE COMISIÓN,EN TRAMITE,S-2311470,10/05/2023,128120,PARLAMENTARIA,CAMARA DE SENADORES,DECLARACIONES UNICAMERALES - (Art. 108-CS y 104-CD REGLAMENTO INTERNO ),ORDINARIO
"Mensaje del Poder Ejecutivo N° 782 de fecha 9 de mayo de 2023, por el cual remite el Proyecto de Ley “QUE APRUEBA LOS CONTRATOS DE PRÉSTAMOS N° 31003 SUSCRITO EL 29 DE DICIEMBRE DE 2022, ENTRE LA ADMINISTRACIÓN NACIONAL DE ELECTRICIDAD (ANDE) Y EL KREDITANSTALT FUR WIEDERAUFBAU (KFW), POR UN MONTO DE HASTA SETENTA Y CINCO MILLONES DE DÓLARES DE LOS ESTADOS UNIDOS DE AMÉRICA (US$ 75.00.000.- ), Y EL CONTRATO DE PRÉSTAMO PAR – 29/2022 SUSCRITO EL 10 DE MARZO DE 2023, ENTRE LA ANDE Y EL FONDO FINANCIERO PARA EL DESARROLLO DE LA CUENCA DEL PLATA (FONPLATA), POR UN MONTO DE HASTA CUARENTA Y CINCO MILLONES DE DÓLARES DE LOS ESTADOS UNIDOS DE AMÉRICA (US$ 45.000.000.-), Y LOS CONTRATOS DE GARANTÍA ENTRE LA REPÚBLICA DEL PARAGUAY, EL KFW Y FONPLATA, PARA EL FINANCIAMIENTO DEL ‘PROYECTO DE CONSTRUCCIÓN DE LA LÍNEA DE TRANSMISIÓN 220 KV VILLA HAYES – VILLA REAL  - POZO COLORADO - LOMA PLATA Y LA SUBESTACIÓN POZO COLORADO EN 220 KV, EN LA REGIÓN OCCIDENTAL’, A CARGO DE LA ANDE, Y AMPLÍA EL PRESUPUESTO GENERAL DE LA NACIÓN PARA EL EJERCICIO FISCAL 2023, APROBADO POR LEY N° 7050/2023”.",http://silpy.congreso.gov.py/expediente/128119,PRIMER TRÁMITE CONSTITUCIONAL,DICTAMEN DE COMISIÓN,EN TRAMITE,S-231893,09/05/2023,128119,PODER EJECUTIVO,CAMARA DE SENADORES,PROYECTO DE LEY,ORDINARIO
"Mensaje del Poder Ejecutivo N° 781 de fecha 3 de mayo de 2023, por el cual remite el Proyecto de Ley “QUE REGLAMENTA LA SENADURÍA VITALICIA”.",http://silpy.congreso.gov.py/expediente/128118,PRIMER TRÁMITE CONSTITUCIONAL,DICTAMEN DE COMISIÓN,EN TRAMITE,S-231892,05/05/2023,128118,PODER EJECUTIVO,CAMARA DE SENADORES,PROYECTO DE LEY,ORDINARIO
"Proyecto de Ley “DE SIMPLIFICACIÓN DE TRÁMITES ADMINISTRATIVOS EN ORGANISMOS Y ENTIDADES DEL ESTADO”, presentado por la Senadora Desirée Graciela Masi Jara, de fecha 8 de mayo de 2023.",http://silpy.congreso.gov.py/expediente/128117,PRIMER TRÁMITE CONSTITUCIONAL,DICTAMEN DE COMISIÓN,EN TRAMITE,S-2311469,10/05/2023,128117,PARLAMENTARIA,CAMARA DE SENADORES,PROYECTO DE LEY,ORDINARIO
"Proyecto de Resolución “QUE PIDE INFORME A LA ADMINISTRACIÓN NACIONAL DE ELECTRICIDAD (ANDE) SOBRE INSTALACIÓN Y HABILITACIÓN DE ALUMBRADO PÚBLICO EN LA AVENIDA INTERNACIONAL DEL DISTRITO DE YPEHÚ, DEPARTAMENTO DE CANINDEYÚ”, presentado por el Senador Pedro Arthuro Santa Cruz Insaurralde, de fecha 9 de mayo de 2023.",http://silpy.congreso.gov.py/expediente/128116,PRIMER TRÁMITE CONSTITUCIONAL,RESOLUCIÓN QUE APRUEBA PEDIDO DE INFORME,EN TRAMITE,S-2311463,08/05/2023,128116,PARLAMENTARIA,CAMARA DE SENADORES,RESOLUCION CON RESPUESTA A PEDIDO DE INFORMES (Art. 192 CN),ORDINARIO
"Proyecto de Resolución “QUE RESUELVE SOLICITAR INFORME AL MINISTERIO DE OBRAS PÚBLICAS Y COMUNICACIONES CON RELACIÓN A LA LICITACIÓN PÚBLICA NACIONAL PARA LA CONTRATACIÓN DE EMPRESAS PARA EL DISEÑO, CONSTRUCCIÓN Y ACCESO VIAL DEL HOSPITAL DE CORONEL OVIEDO – CAAGUAZÚ – AD REFERENDUM A LA APROBACIÓN PRESUPUESTARIA, ID N° 385592”, presentado por el Senador Daniel Rojas López, de fecha 8 de mayo de 2023.",http://silpy.congreso.gov.py/expediente/128115,PRIMER TRÁMITE CONSTITUCIONAL,RESOLUCIÓN QUE APRUEBA PEDIDO DE INFORME,EN TRAMITE,S-2311462,08/05/2023,128115,PARLAMENTARIA,CAMARA DE SENADORES,RESOLUCION CON RESPUESTA A PEDIDO DE INFORMES (Art. 192 CN),ORDINARIO
"Proyecto de Ley “QUE MODIFICA EL ARTÍCULO 1° DE LA LEY N° 4.307 ‘QUE DECLARA DE INTERÉS SOCIAL Y EXPROPIA A FAVOR DE LA SECRETARÍA NACIONAL DE LA VIVIENDA Y EL HABITAT (SENAVITAT), UN INMUEBLE INDIVIDUALIZADO COMO PARTE DE LA FINCA N° 6.292 UBICADO EN EL BARRIO REMANSITO – SECTOR 6 DEL MUNICIPIO DE CIUDAD DEL ESTE, PARA SU POSTERIOR TRANSFERENCIA A TÍTULO ONEROSO A FAVOR DE SUS ACTUALES OCUPANTES”, presentado por la Senadora Georgia María Arrúa de Dolinsky, de fecha 10 de mayo de 2023.",http://silpy.congreso.gov.py/expediente/128114,PRIMER TRÁMITE CONSTITUCIONAL,DICTAMEN DE COMISIÓN,EN TRAMITE,S-2311471,10/05/2023,128114,PARLAMENTARIA,CAMARA DE SENADORES,PROYECTO DE LEY,ORDINARIO
"Proyecto de Resolución “QUE PIDE INFORME AL INSTITUTO PARAGUAYO DEL INDÍGENA (INDI)”, presentado por la Senadora Georgia María Arrúa de Dolinsky, de fecha 10 de mayo de 2023.",http://silpy.congreso.gov.py/expediente/128112,PRIMER TRÁMITE CONSTITUCIONAL,DICTAMEN DE COMISIÓN,EN TRAMITE,S-2311467,10/05/2023,128112,PARLAMENTARIA,CAMARA DE SENADORES,RESOLUCION CON RESPUESTA A PEDIDO DE INFORMES (Art. 192 CN),ORDINARIO
"Proyecto de Ley “QUE REGLAMENTA EL ARTÍCULO 106 DE LA CONSTITUCIÓN NACIONAL Y ESTABLECE LA RESPONSABILIDAD DEL FUNCIONARIO Y DEL EMPLEADO PÚBLICO”, presentado por la Senadora Georgia María Arrúa de Dolinsky, de fecha 9 de mayo de 2023.",http://silpy.congreso.gov.py/expediente/128111,PRIMER TRÁMITE CONSTITUCIONAL,DICTAMEN DE COMISIÓN,EN TRAMITE,S-2311466,09/05/2023,128111,PARLAMENTARIA,CAMARA DE SENADORES,PROYECTO DE LEY,ORDINARIO
"Proyecto de Ley “QUE CONCEDE PENSIÓN GRACIABLE AL SEÑOR VALERIO AYALA NOGUERA”, presentado por el Senador Sixto Pereira Galeano, de fecha 8 de mayo de 2023.",http://silpy.congreso.gov.py/expediente/128110,PRIMER TRÁMITE CONSTITUCIONAL,DICTAMEN DE COMISIÓN,EN TRAMITE,S-2311465,09/05/2023,128110,PARLAMENTARIA,CAMARA DE SENADORES,PROYECTO DE LEY,ORDINARIO
"Proyecto de Ley “DE PROTECCIÓN A PERIODISTAS Y PERSONAS DEFENSORAS DE DERECHOS HUMANOS”, presentado por los Senadores Blas Lanzoni Achinelli, José Gregorio Ledesma Narváez y Gilberto Antonio Apuril Santiviago, de fecha 26 de abril de 2023.",http://silpy.congreso.gov.py/expediente/128109,PRIMER TRÁMITE CONSTITUCIONAL,DICTAMEN DE COMISIÓN,EN TRAMITE,S-2311464,09/05/2023,128109,PARLAMENTARIA,CAMARA DE SENADORES,PROYECTO DE LEY,ORDINARIO
"QUE MODIFICA EL ARTICULO 25 DE LA LEY 438/94 QUE REGULA LA CONSTITUCION, ORGANIZACION, Y FUNCIONAMIENTOS DE LAS COOPERATIVAS Y DEL SECTORCOOPERATIVO. Presentado por el Diputado Edwin Reimer",http://silpy.congreso.gov.py/expediente/128108,PRIMER TRÁMITE CONSTITUCIONAL,DICTAMEN DE COMISIÓN,EN TRAMITE,D-2371944,10/05/2023,128108,PARLAMENTARIA,CAMARA DE DIPUTADOS,PROYECTO DE LEY,ORDINARIO
"QUE CONCEDE PENSION GRACIABLE AL SEÑOR OSCAR CARDOZO. Presentado por los Diputados Basilio Núñez, y Juan Galaverna. ",http://silpy.congreso.gov.py/expediente/128107,PRIMER TRÁMITE CONSTITUCIONAL,DICTAMEN DE COMISIÓN,EN TRAMITE,D-2371946,10/05/2023,128107,PARLAMENTARIA,CAMARA DE DIPUTADOS,PROYECTO DE LEY,ORDINARIO
"QUE PROMUEVE LA ORGANIZACION,CONSTITUCION Y PUESTA EN FUNCIONAMIENTOS DE UNO O MAS FONDOS DE GARANTIAS DE AHORROS EN COOPERATIVAS, presentado por el Diputado Edwin Buhler.",http://silpy.congreso.gov.py/expediente/128106,PRIMER TRÁMITE CONSTITUCIONAL,DICTAMEN DE COMISIÓN,EN TRAMITE,D-2371945,10/05/2023,128106,PARLAMENTARIA,CAMARA DE DIPUTADOS,PROYECTO DE LEY,ORDINARIO
"QUE SOLICITA INFORMES AL MINISTERIO DEL TRABAJO SOBRE LAS POLITICAS DE INCENTIVO DEL TRABAJO A LAS PERSONAS MAYORES, presentado por la Diputada Nacional Rocío Vallejo",http://silpy.congreso.gov.py/expediente/128105,PRIMER TRÁMITE CONSTITUCIONAL,DICTAMEN DE COMISIÓN,EN TRAMITE,D-2371943,11/05/2023,128105,PARLAMENTARIA,CAMARA DE DIPUTADOS,RESOLUCION CON RESPUESTA A PEDIDO DE INFORMES (Art. 192 CN),ORDINARIO
"QUE PIDE INFORMES AL CONSEJO NACIONAL DE EDUCACION SUPERIOR (CONES), presentado por la Diputada Rocío Abed",http://silpy.congreso.gov.py/expediente/128102,PRIMER TRÁMITE CONSTITUCIONAL,DICTAMEN DE COMISIÓN,EN TRAMITE,D-2371903,09/05/2023,128102,PARLAMENTARIA,CAMARA DE DIPUTADOS,RESOLUCION CON RESPUESTA A PEDIDO DE INFORMES (Art. 192 CN),ORDINARIO
"QUE DECLARA DE INTERES NACIONAL Y CULTURAL LA PARTICIPACION ARTISTICA PROYECTADA POR LA COMPAÑIA DE DANZAS ""REPUBLICA SARAKI"" Y EL GRUPO MUSICAL ""GENESIS"" DE LA CIUDAD DE LUQUE, A REALIZARSE EN EL MES DE AGOSTO POR EL CONTINENTE EUROPEO, FESTIVAL MUNDIAL DEL FOLKLORE DE JAMBES - NAMUR (BELGICA) Y FESTIVAL DE HOUBLON (FRANCIA) - presentado por el Diputado Carlos Núñez Salinas.",http://silpy.congreso.gov.py/expediente/128101,PRIMER TRÁMITE CONSTITUCIONAL,DICTAMEN DE COMISIÓN,EN TRAMITE,D-2371924,10/05/2023,128101,PARLAMENTARIA,CAMARA DE DIPUTADOS,DECLARACIONES UNICAMERALES - (Art. 108-CS y 104-CD REGLAMENTO INTERNO ),ORDINARIO
"QUE INSTA AL PODER EJECUTIVO - PRESIDENCIA DE LA REPUBLICA AL CESE DE LA PERTURBACION DE LA PAZ PUBLICA A LA CIUDADANIA PARAGUAYA ANTE LA INOPERANCIA DE SU GESTION RESULTANTE DE LA CORRUPCION, INSEGURIDAD Y LA FALTA DE OPORTUNIDADES. Presentado por el Diputado Jorge Britez. ",http://silpy.congreso.gov.py/expediente/128100,PRIMER TRÁMITE CONSTITUCIONAL,DICTAMEN DE COMISIÓN,EN TRAMITE,D-2371901,09/05/2023,128100,PARLAMENTARIA,CAMARA DE DIPUTADOS,DECLARACIONES UNICAMERALES - (Art. 108-CS y 104-CD REGLAMENTO INTERNO ),ORDINARIO
"QUE INSTA AL MINISTERIO PUBLICO - FISCALIA GENERAL DEL ESTADO QUE, EN EL MARCO DE LA INVESTIGACION DEL ASESINATO DE RODRIGO
QUINTANA, JOVEN DIRIGENTE LIBERAL, SEAN INCAUTADOS LOS TELEFONOS CELULARES DE HORACIO MANUEL CARTES JARA, EX PRESIDENTE DE LA REPUBLICA DEL PARAGUAY; TADEO ROJAS, EX MINISTRO DEL INTERIOR Y CRISPULO SOTELO, EX COMANDANTE DE LA POLICIA NACIONAL Y SOLICITAR AUTORIZACION JUDICIAL PARA LA EXTRACCION DE DATOS Y/O DESGRABACION DE LOS CONTENIDOS DE DICHOS EQUIPOS ELECTRONICOS, presentado por el Diputado Jorge Britez",http://silpy.congreso.gov.py/expediente/128099,PRIMER TRÁMITE CONSTITUCIONAL,DICTAMEN DE COMISIÓN,EN TRAMITE,D-2371925,10/05/2023,128099,PARLAMENTARIA,CAMARA DE DIPUTADOS,DECLARACIONES UNICAMERALES - (Art. 108-CS y 104-CD REGLAMENTO INTERNO ),ORDINARIO
"QUE PIDE INFORMES A LA AGENCIA NACIONAL DE EVALUACION Y ACREDITACION DE LA EDUCACION SUPERIOR (ANEAES), presentado por la Diputada Rocío Abed.",http://silpy.congreso.gov.py/expediente/128098,PRIMER TRÁMITE CONSTITUCIONAL,DICTAMEN DE COMISIÓN,EN TRAMITE,D-2371902,09/05/2023,128098,PARLAMENTARIA,CAMARA DE DIPUTADOS,RESOLUCION CON RESPUESTA A PEDIDO DE INFORMES (Art. 192 CN),ORDINARIO
"QUE INSTA AL MINISTERIO DE OBRAS PÚBLICAS Y COMUNICACIONES (MOPC) A LA REPARACIÓN DE CAMINOS, DE LOS TRAMOS DE PUERTO CASADO HASTA EL DESVÍO DE KILOMETRO 83, DEL DESVÍO KM 65 HASTA TORO PAMPA, DESDE TORO PAMPA HASTA FUERTE OLIMPO Y DESDE TORO PAMPA HASTA BAHÍA NEGRA, DEPARTAMENTO ALTO PARAGUAY , presentado por los Diputados Carlos Núñez y Marlene Ocampos.",http://silpy.congreso.gov.py/expediente/128097,PRIMER TRÁMITE CONSTITUCIONAL,DISCUSION PLENARIO,EN TRAMITE,D-2371883,04/05/2023,128097,PARLAMENTARIA,CAMARA DE DIPUTADOS,DECLARACIONES UNICAMERALES - (Art. 108-CS y 104-CD REGLAMENTO INTERNO ),ORDINARIO
"Mensaje del Poder Ejecutivo N° 778.- Ministerio de Relaciones Exteriores, de fecha 25 de abril de 2023, por el cual remite el Proyecto de Ley “QUE APRUEBA EL MEMORÁNDUM DE ENTENDIMIENTO ENTRE EL GOBIERNO DE LA REPÚBLICA DEL PARAGUAY Y EL GOBIERNO DE AUSTRALIA SOBRE EMPLEO DE LOS FAMILIARES DEPENDIENTES DEL PERSONAL DIPLOMÁTICO, CONSULAR Y PERSONAL ADMINISTRATIVO Y TÉCNICO”, suscrito en la ciudad de Canberra, Mancomunidad de Australia, el 14 de marzo de 2023.",http://silpy.congreso.gov.py/expediente/128096,PRIMER TRÁMITE CONSTITUCIONAL,DICTAMEN DE COMISIÓN,EN TRAMITE,S-231891,26/04/2023,128096,PODER EJECUTIVO,CAMARA DE SENADORES,PROYECTO DE LEY,ORDINARIO
"Proyecto de Declaración “QUE RECONOCE A CELSA RAMÍREZ SU SIGNIFICATIVO APORTE EN LA DEFENSA DE LOS DERECHOS HUMANOS Y EN LA CONSTRUCCIÓN DE UN PAÍS DEMOCRÁTICO, PLURALISTA Y LIBRE, ASÍ COMO SU ENTEREZA FRENTE A LAS ATROCIDADES DE LA DICTADURA Y SU VALENTÍA Y CORAJE EN LA LUCHA POR LA JUSTICIA, LA IGUALDAD Y LA DIGNIDAD DEL PUEBLO PARAGUAYO”, presentado por el Senador Carlos Alberto Filizzola Pallarés, de fecha 4 de mayo de 2023.",http://silpy.congreso.gov.py/expediente/128095,PRIMER TRÁMITE CONSTITUCIONAL,DISCUSION PLENARIO,EN TRAMITE,S-2311457,04/05/2023,128095,PARLAMENTARIA,CAMARA DE SENADORES,DECLARACIONES UNICAMERALES - (Art. 108-CS y 104-CD REGLAMENTO INTERNO ),ORDINARIO
"Proyecto de Ley “QUE DECLARA DE INTERÉS SOCIAL Y EXPROPIA A FAVOR DEL INSTITUTO NACIONAL DE DESARROLLO RURAL Y DE LA TIERRA (INDERT) A LOS FINES DE LA REFORMA AGRARIA, LOS INMUEBLES INDIVIDUALIZADOS COMO FINCA N° 24 Y FINCA N° 36 DEL DISTRITO DE YASY KAÑY DEPARTAMENTO DE CANINDEYÚ Y LA FINCA N° 3.109 DEL DISTRITO DE YHU, DEPARTAMENTO DE CAAGUAZÚ, PARA SU POSTERIOR TRANSFERENCIA A TÍTULO ONEROSO A FAVOR DE LOS ACTUALES OCUPANTES”, presentado por el Senador José Gregorio Ledesma Narváez, de fecha 25 de abril de 2023.",http://silpy.congreso.gov.py/expediente/128094,PRIMER TRÁMITE CONSTITUCIONAL,DICTAMEN DE COMISIÓN,EN TRAMITE,S-2311456,28/04/2023,128094,PARLAMENTARIA,CAMARA DE SENADORES,PROYECTO DE LEY,ORDINARIO
"Proyecto de Ley “QUE DECLARA DE INTERÉS SOCIAL Y EXPROPIA A FAVOR DEL INSTITUTO NACIONAL DE DESARROLLO RURAL Y DE LA TIERRA (INDERT) A LOS FINES DE LA REFORMA AGRARIA, LOS INMUEBLES INDIVIDUALIZADOS COMO N°s 114, 515, 501 Y 502 TODAS DEL DISTRITO DE CURUGUATY, DEPARTAMENTO DE CANINDEYÚ, EN EL LUGAR DENOMINADO MARACANÁ, EN LA COLONÍA SAN MIGUEL, PARA SU POSTERIOR TRANSFERENCIA A TÍTULO ONEROSO A FAVOR DE LOS ACTUALES OCUPANTES”, presentado por el Senador José Gregorio Ledesma Narváez, de fecha 28 de abril de 2023.",http://silpy.congreso.gov.py/expediente/128093,PRIMER TRÁMITE CONSTITUCIONAL,DICTAMEN DE COMISIÓN,EN TRAMITE,S-2311455,28/04/2023,128093,PARLAMENTARIA,CAMARA DE SENADORES,PROYECTO DE LEY,ORDINARIO
"QUE INSTA A LA CORTE SUPREMA DE JUSTICIA, SALA CONSTITUCIONAL A EXPEDIRSE EN LA BREVEDAD SOBRE LO RESUELTO EN EL A.I. Nº 40 DEL 11 DE FEBRERO DE 2022",http://silpy.congreso.gov.py/expediente/128092,PRIMER TRÁMITE CONSTITUCIONAL,DICTAMEN DE COMISIÓN,EN TRAMITE,D-2371843,02/05/2023,128092,PARLAMENTARIA,CAMARA DE DIPUTADOS,DECLARACIONES UNICAMERALES - (Art. 108-CS y 104-CD REGLAMENTO INTERNO ),ORDINARIO
"QUE PIDE INFOMES AL SERVICIO NACIONAL DE SANEAMIENTO AMBIENTAL-SENASA, sobre la construcción de obras del sistema de alcantarillado sanitario condominal. Presentado por el Diputado Colin Soroka.",http://silpy.congreso.gov.py/expediente/128091,PRIMER TRÁMITE CONSTITUCIONAL,DISCUSION PLENARIO,EN TRAMITE,D-2371848,03/05/2023,128091,PARLAMENTARIA,CAMARA DE DIPUTADOS,RESOLUCION CON RESPUESTA A PEDIDO DE INFORMES (Art. 192 CN),ORDINARIO
"Proyecto de Resolución “QUE SOLICITA INFORME AL PODER EJECUTIVO – MINISTERIO DE RELACIONES EXTERIORES”, presentado por la Senadora Desirée Graciela Masi Jara, de fecha 25 de abril de 2023.",http://silpy.congreso.gov.py/expediente/128090,PRIMER TRÁMITE CONSTITUCIONAL,INGRESO DE RESPUESTA A PEDIDO DE INFORME,EN TRAMITE,S-2311454,25/04/2023,128090,PARLAMENTARIA,CAMARA DE SENADORES,RESOLUCION CON RESPUESTA A PEDIDO DE INFORMES (Art. 192 CN),ORDINARIO
"QUE PIDE INFORMES AL PODER EJECUTIVO - SECRETARIA NACIONAL DE CULTURA (SNC) - CONFORME A DENUNCIAS ARRIMADAS ANTE LA COMISION DE EDUCACION, CULTURA Y CULTO. Presentado por el Diputado Sebastián Villarejo. ",http://silpy.congreso.gov.py/expediente/128089,PRIMER TRÁMITE CONSTITUCIONAL,DISCUSION PLENARIO,EN TRAMITE,D-2371823,24/04/2023,128089,PARLAMENTARIA,CAMARA DE DIPUTADOS,RESOLUCION CON RESPUESTA A PEDIDO DE INFORMES (Art. 192 CN),ORDINARIO
"QUE PIDE INFORME AL PODER EJECUTIVO-MINISTERIO DEL INTERIOR -POLICIA NACIONAL, en relación al trágico y lamentable crimen de una niña de 3 años de edad del asentamiento Romero Cué de la Ciudad de Pedro Juan Caballero, Dpto. de Amambay presentado por los Diputados  Tito Ibarrola y Carlos Rejala.",http://silpy.congreso.gov.py/expediente/128088,PRIMER TRÁMITE CONSTITUCIONAL,DISCUSION PLENARIO,EN TRAMITE,D-2371824,28/04/2023,128088,PARLAMENTARIA,CAMARA DE DIPUTADOS,RESOLUCION CON RESPUESTA A PEDIDO DE INFORMES (Art. 192 CN),ORDINARIO
"QUE PIDE INFORME AL PODER EJECUTIVO - SECRETARIA NACIONAL ANTIDROGAS (SENAD), presentado por los Diputados Nacionales Carlos Rejala y Tito Ibarrola",http://silpy.congreso.gov.py/expediente/128087,PRIMER TRÁMITE CONSTITUCIONAL,DISCUSION PLENARIO,EN TRAMITE,D-2371825,28/04/2023,128087,PARLAMENTARIA,CAMARA DE DIPUTADOS,RESOLUCION CON RESPUESTA A PEDIDO DE INFORMES (Art. 192 CN),ORDINARIO
"QUE DESAFECTA DEL DOMINIO PUBLICO MUNICIPAL Y AUTORIZA A LA MUNICIPALIDAD DE LAMBARE A TRANSFERIR A TITULO ONEROSO A FAVOR DE LOS ACTUALES OCUPANTES, PARTE DEL DOMINIO PUBLICO MUNICIPAL - CALLE DENOMINADA ATANASIO CABAÑAS, MARY LIONS Y LA TOTALIDAD DE LA CALLE 6 UBICADO EN EL BARRIO CUATRO MOJONES DE LA CIUDAD DE LAMBARE - presentado por la Diputada Jazmín Narváez. ",http://silpy.congreso.gov.py/expediente/128086,PRIMER TRÁMITE CONSTITUCIONAL,DICTAMEN DE COMISIÓN,EN TRAMITE,D-2371819,24/04/2023,128086,PARLAMENTARIA,CAMARA DE DIPUTADOS,PROYECTO DE LEY,ORDINARIO
"DE PROTECCION, SALVAGUARDA Y PRESERVACION DEL ACERVO HISTORICO, CULTURAL Y CIENTIFICO DE LOS MUSEOS DEL PARAGUAY. Presentado por el Diputado Hugo Ramirez",http://silpy.congreso.gov.py/expediente/128085,PRIMER TRÁMITE CONSTITUCIONAL,DICTAMEN DE COMISIÓN,EN TRAMITE,D-2371809,21/04/2023,128085,PARLAMENTARIA,CAMARA DE DIPUTADOS,PROYECTO DE LEY,ORDINARIO
"Proyecto de Resolución “QUE PIDE INFORME AL PODER EJECUTIVO – PRESIDENCIA DE LA REPÚBLICA”, presentado por el Senador Stephan Rasmussen González, de fecha 20 de abril de 2023.",http://silpy.congreso.gov.py/expediente/128084,PRIMER TRÁMITE CONSTITUCIONAL,INGRESO DE RESPUESTA A PEDIDO DE INFORME,EN TRAMITE,S-2311453,24/04/2023,128084,PARLAMENTARIA,CAMARA DE SENADORES,RESOLUCION CON RESPUESTA A PEDIDO DE INFORMES (Art. 192 CN),ORDINARIO
"Proyecto de Ley “QUE DESAFECTA DEL DOMINIO PÚBLICO MUNICIPAL Y AUTORIZA A LA MUNICIPALIDAD DE SAN LORENZO A TRANSFERIR A TÍTULO ONEROSO A FAVOR DE SU ACTUAL OCUPANTE, UN INMUEBLE INDIVIDUALIZADO COMO FINCA MATRIZ N° 11.711, CTA. CTE. CTRAL. N° 27-0721 – 01, UBICADO EN EL BARRIO SANTA ANA DEL CITADO MUNICIPIO”, presentado por el Senador Oscar Rubén Salomón Fernández, de fecha 24 de abril de 2023.",http://silpy.congreso.gov.py/expediente/128083,PRIMER TRÁMITE CONSTITUCIONAL,DICTAMEN DE COMISIÓN,EN TRAMITE,S-2311452,24/04/2023,128083,PARLAMENTARIA,CAMARA DE SENADORES,PROYECTO DE LEY,ORDINARIO
"Proyecto de Ley “QUE AMPLÍA EL PRESUPUESTO GENERAL DE LA NACIÓN PARA EL EJERCICIO FISCAL 2023, APROBADO POR LEY N° 7050/2023 ‘MINISTERIO DE LA NIÑEZ Y LA ADOLESCENCIA”, presentado por los Senadores Oscar Hugo Richer Florentín, José Gregorio Ledesma Narváez, Silvio Adalberto Ovelar Benitez, Esperanza Martínez de Portillo, Enrique Salyn Concepción Buzarquis Cáceres y Miguel Fulgencio Rodríguez Romero, de fecha 24 de abril de 2023.",http://silpy.congreso.gov.py/expediente/128082,PRIMER TRÁMITE CONSTITUCIONAL,DICTAMEN DE COMISIÓN,EN TRAMITE,S-2311451,21/04/2023,128082,PARLAMENTARIA,CAMARA DE SENADORES,PROYECTO DE LEY,ORDINARIO
"QUE DECLARA DE INTERÉS NACIONAL LA ""PRIMERA SEMANA INTERNACIONAL DE ESCULTISMO, SOBRE LAS AGUAS"", presentado por los Diputados Nacionales Hugo Capurro y Pastor Vera",http://silpy.congreso.gov.py/expediente/128081,FINALIZACIÓN DE TRAMITACIÓN,SE COMUNICA A QUIEN CORRESPONDA,COMUNICADO,D-2371735,19/04/2023,128081,PARLAMENTARIA,CAMARA DE DIPUTADOS,DECLARACIONES UNICAMERALES - (Art. 108-CS y 104-CD REGLAMENTO INTERNO ),ORDINARIO
"QUE INSTA A TODOS LOS MUNICIPIOS Y GOBERNACIONES DEL PAIS, A PROMOVER LA FORMACION DE COMUNIDADES ENERGETICAS - presentado por los Diputados Carlos Rejala y Tito Ibarrola.",http://silpy.congreso.gov.py/expediente/128080,PRIMER TRÁMITE CONSTITUCIONAL,RESOLUCIÓN QUE APRUEBA DECLARACIÓN,EN TRAMITE,D-2371736,18/04/2023,128080,PARLAMENTARIA,CAMARA DE DIPUTADOS,DECLARACIONES UNICAMERALES - (Art. 108-CS y 104-CD REGLAMENTO INTERNO ),ORDINARIO
"QUE MODIFICA EL ARTICULO 1º DE LA LEY Nº 6.316/2018 QUE DESAFECTA DEL DOMINIO PUBLICO MUNICIPAL Y AUTORIZA A LA MUNICIPALIDAD DE ASUNCIÓN, A TRANSFERIR A TITULO ONEROSO A FAVOR DE INTERCAMBIOS MERCANTILES S.A., UNA FRACCION DE INMUEBLE INDIVIDUALIZADO COMO PARTE DE LA FINCA Nº 23118, DEL DISTRITO DE LA RECOLETA DEL CITADO MUNICIPIO - presentado por el Diputado Néstor Ferrer. ",http://silpy.congreso.gov.py/expediente/128079,PRIMER TRÁMITE CONSTITUCIONAL,DICTAMEN DE COMISIÓN,EN TRAMITE,D-2371793,19/04/2023,128079,PARLAMENTARIA,CAMARA DE DIPUTADOS,PROYECTO DE LEY,ORDINARIO
"QUE MODIFICA EL ARTÍCULO 44 DE LA LEY N° 7021/2022 ‘DE SUMINISTRO Y CONTRATACIONES PÚBLICAS’ Y MODIFICA EL ARTÍCULO 193 DE LA LEY N° 7050 ‘QUE APRUEBA EL PRESUPUESTO GENERAL DE LA NACIÓN PARA EL EJERCICIO FISCAL 2023’, presentado por los Diputados Nacionales Emilio Pavón, Celso Kennedy, Pastor Vera Bejarano, Jorge Ávalos y Fernando Oreggioni",http://silpy.congreso.gov.py/expediente/128078,PRIMER TRÁMITE CONSTITUCIONAL,DICTAMEN DE COMISIÓN,EN TRAMITE,D-2371795,19/04/2023,128078,PARLAMENTARIA,CAMARA DE DIPUTADOS,PROYECTO DE LEY,ORDINARIO
"QUE DESAFECTA DEL DOMINIO PUBLICO MUNICIPAL Y AUTORIZA A LA MUNICIPALIDAD DE ASUNCION, A TRANSFERIR A TITULO ONEROSO UN INMUEBLE INDIVIDUALIZADO CON FINCA N.º 2316 CTA CTE CTRAL N.º 14-0414-13 A FAVOR DE SU ACTUAL OCUPANTE. Presentado por la Diputada Del Pilar Medina. ",http://silpy.congreso.gov.py/expediente/128077,PRIMER TRÁMITE CONSTITUCIONAL,DICTAMEN DE COMISIÓN,EN TRAMITE,D-2371792,19/04/2023,128077,PARLAMENTARIA,CAMARA DE DIPUTADOS,PROYECTO DE LEY,ORDINARIO
QUE ESTABLECE EL DIA NACIONAL DEL MEDICO ESTETICO - presentado por la Diputada Rocío Abed.,http://silpy.congreso.gov.py/expediente/128076,PRIMER TRÁMITE CONSTITUCIONAL,DICTAMEN DE COMISIÓN,EN TRAMITE,D-2371794,19/04/2023,128076,PARLAMENTARIA,CAMARA DE DIPUTADOS,PROYECTO DE LEY,ORDINARIO
"QUE DECLARA DE INTERES SOCIAL Y EXPROPIA A FAVOR DEL MINISTERIO DE URBANISMO, VIVIENDA Y HABITAD (MUVH), UN INMUEBLE INDIVIDUALIZADO COMO, FINCA Nº 6008, SITUADO EN LA CALLE 10 Y 11 ACARAY CON UNA SUPERFICIE DE 2 HAS, UBICADO EN EL DISTRITO DE CIUDAD DEL ESTE, DEPARTAMENTO DE ALTO PARANA, PARA SU POSTERIOR TRANSFERENCIA A TITULO ONEROSO A FAVOR DE LOS ACTUALES OCUPANTES DEL ASENTAMIENTO 1 DE JUNIO, presentado por el Diputada Nacional Blanca Vargas de Caballero",http://silpy.congreso.gov.py/expediente/128075,PRIMER TRÁMITE CONSTITUCIONAL,DICTAMEN DE COMISIÓN,EN TRAMITE,D-2371729,19/04/2023,128075,PARLAMENTARIA,CAMARA DE DIPUTADOS,PROYECTO DE LEY,ORDINARIO
"QUE SUSPENDE POR TIEMPO INDETERMINADO, DENTRO DEL MARCO DEL PROYECTO ASUNCION VERDE DE LAS AMERICAS – VIAS A LA SUSTENTABILIDAD, LA CONSTRUCCIÓN Y OTRAS INTERVENCIONES EN MATERIA DE INFRAESTRUCTURA VIAL REALIZADA POR LOS ORGANISMOS Y ENTIDADES DEL ESTADO PARA LA HABILITACIÓN DE CARRILES PREFERENCIALES PARA BICICLETAS DENOMINADAS BICISENDAS DENTRO DEL AREA METROPOLITANA DE ASUNCIÓN, presentado por los Diputados:Guadalupe Aveiro, Basilio Gustavo Núñez Giménez, Jazmín Narváez Osorio, Miguel Tadeo Rojas Meza y Justo Aricio Zacarías.
		
",http://silpy.congreso.gov.py/expediente/128074,PRIMER TRÁMITE CONSTITUCIONAL,DICTAMEN DE COMISIÓN,EN TRAMITE,D-2371727,19/04/2023,128074,PARLAMENTARIA,CAMARA DE DIPUTADOS,PROYECTO DE LEY,ORDINARIO
